{
  "schema_version": "1.0",
  "workflow_id": "workflow.review.starter",
  "family": "workflow",
  "governance_level": "controlled",
  "execution_mode": "gated",
  "version_anchor": "v1",
  "explanation_ref": "WORKFLOW.md",
  "policy_refs": [
    "policy.guard.review"
  ],
  "object_refs": [
    "state.review.partial",
    "action.review",
    "evidence.review.note",
    "approval.human.review",
    "output.publish.review"
  ],
  "agent_refs": [
    "agent.review"
  ],
  "entry_intents": [
    {
      "intent_id": "intent.review",
      "entry_node": "node.review",
      "aliases": [
        "start review",
        "continue review"
      ]
    }
  ],
  "nodes": [
    {
      "node_id": "node.review",
      "state_ref": "state.review.partial",
      "action_ref": "action.review",
      "evidence_refs": [
        "evidence.review.note"
      ],
      "output_policy_refs": [
        "policy.guard.review"
      ],
      "approver_ref": "role.reviewer"
    }
  ],
  "transitions": [
    {
      "transition_id": "transition.review-to-review",
      "from_node": "node.review",
      "to_node": "node.review",
      "guard_policy_refs": [
        "policy.guard.review"
      ],
      "approval_ref": "approval.human.review"
    }
  ],
  "checks": {
    "route": [
      "check.route.review"
    ],
    "evidence": [
      "check.evidence.review"
    ],
    "write": [
      "check.write.review"
    ],
    "stop": [
      "check.stop.review"
    ]
  }
}
